"Location_ID","X_Coord","Y_Coord","Latitude","Longitude","Coord_Units","Coord_System","UTM_Zone","Datum","Est_H_Error","Unit_ID","Loc_Type","Loc_Notes","Plot_Number","GRTS_Order","Panel","Directions","Rejected","Elevation","Aspect","Orientation","Change_Orientation","Physiographic_Class","Terrain_Position","USNVC_Formation","Created_By","Created_Date","Updated_By","Updated_Date","Stand_Origin_Year"
"AFB5C4CB-7FAD-4B53-9463-60E2A43574D9",272602,4234309,38.2280461,-77.59788883,"meters","UTM","18N","NAD83",0,"FRSP_SPOT","VS","Mixed mostly hardwood canopy (Beech and Tulip Poplar). Sparse ground cover. Ground hornet nest near tree 1884.","058",4,"1","Park at Bloody Angle. Walk in either on trail across field or on forest road to the left of field. Both end up at the same place and have about a 100m bushwack to plot.",FALSE,NA,0,10,FALSE,23,NA,NA,"Johanna  Fickenscher",2011-10-04 11:49:53,"Camilla  Seirup",2015-08-18 09:03:09,NA
"AFCF457A-3D97-4FD8-8784-D77BC2401070",365342,4119542,37.21265518,-76.51760704,"meters","UTM","18N","NAD83",3,"COLO_YORK","VS","Open wet plot along Beaver Dam Creek tributary. Bring boots and sun protection.","366",47,"3","Park on Historical Tour Drive on the west side of Beaver Dam Creek and walk along earthworks for about 400m.",FALSE,NA,0,360,FALSE,26,NA,NA,"Emilie  Schuler",2013-08-14 08:23:11,"Emilie  Schuler",2013-08-14 08:23:20,NA
"AFE5B078-D6C5-423D-BA66-43950C2B566F",694833,4139797,37.38447239,-78.79928908,"meters","UTM","17N","NAD83",NA,"APCO","VS","Pinus taeda and Liriodendron tulipifera overstory, Quercus rubra, Acer rubrum, Carya midstory. Low ground cover and open understory","009",5,"1","Take Gordon drive from main park road and follow around curve. Park by driveway 896 (dirt road) and walk in approx 300m. Once you get through initial shrubs into the forest, easy walking through open understory",FALSE,NA,30,16,FALSE,2,NA,NA,"Johanna  Fickenscher",2011-08-22 16:18:13,"Tandena  Wagner",2019-07-29 13:34:11,NA
"B1D13412-43AD-4EC8-AE7C-F177CE322D9F",291350,4124048,37.23962526,-77.35223677,"meters","UTM","18N","NAD83",NA,"PETE_EAST","VS","Marker moved 2 ft south (this note is very vague and I'm not sure what is meant by it..JH2015)

2015: Orientation changed to 3 degrees.","027",10,"1","Park at trail head at beginning of tour road. But just bushwack to plot, easy hike, trail takes you out of the way.",FALSE,NA,70,3,FALSE,22,NA,NA,"Josh J Hamrick",2012-06-13 16:20:05,"Camilla  Seirup",2019-08-12 09:58:12,NA
"B2BC9DF0-8895-4ED9-8024-C49F0AFB03D4",284845,4237301,38.25799839,-77.45904996,"meters","UTM","18N","NAD83",2.29999995231628,"FRSP_FRED","VS","American Holly understory mixed hardwood canopy","272",28,"4","~150 m @ 320 degrees from trail off of Lee Drive",FALSE,NA,0,360,FALSE,21,NA,NA,"{1E30DBBB-8860-48D4-95EC-A8F90A7ED26B}",2010-09-28 10:40:56,"{1E30DBBB-8860-48D4-95EC-A8F90A7ED26B}",2010-09-28 10:41:06,NA
"B34F1CD3-0507-428C-8041-5D999AABE31F",309127,4408804,39.80780258,-77.22976025,"meters","UTM","18N","NAD83",1.70000004768372,"GETT","VS","changed orientation from 360 to 350.  Right next to road and trail.  Very wet plot.  Lots of shrubs and very difficult to find rebar as well as stakes.","087",24,"2",NA,FALSE,NA,0,350,FALSE,21,NA,NA,"Evan K Heck",2012-06-13 16:20:05,"Josh J Hamrick",2016-08-02 09:01:22,NA
"B3624350-AC95-4889-AAA0-94A4E778542A",NA,NA,NA,NA,"meters","UTM","18N","NAD83",NA,"GETT","VS",NA,"",17,NA,NA,TRUE,NA,NA,360,FALSE,NA,NA,NA,NA,2012-06-13 16:20:05,NA,2012-06-13 16:20:05,NA
"B36A8115-7E89-44A9-B347-67191D27AAF4",NA,NA,NA,NA,"Meters","UTM","18N","NAD83",NA,"PETE_EAST","VS","With forest pennisula with mowed field on all sides.",NA,30,NA,NA,TRUE,NA,NA,NA,FALSE,NA,NA,NA,NA,2010-09-22 14:50:25,NA,2010-09-22 14:50:25,NA
"B3DA2E22-E1B7-4381-A2BF-F7F72B1D0C76",364599,4120797,37.22385628,-76.52620588,"meters","UTM","18N","NAD83",3,"COLO_YORK","VS","Tulip poplar canopy with ferns in understory.  Interesting donut hole pit dug into the ground abouut 4m in diameter.
* Plot Marked as #356 in 2013, will need to update Tag to #357","357",39,"3","Plot off Crawford Rd. Park at pull out 500m past plot. Walk back along road and cut into forest at 100m from plot. Plot center stake was missing, new tag number",FALSE,NA,0,360,FALSE,21,NA,NA,"Camilla  Seirup",2013-08-08 11:50:15,"Danielle  Bara",2017-08-07 15:00:04,NA
"B504BE41-8A11-415C-B07C-D0F565ED7CD2",287101,4236049,38.24726227,-77.43291117,"meters","UTM","18N","NAD83",NA,"FRSP_FRED","VS","Pinus virginiana/liq sty fairly open canopy. Some microstegium and cyperaceae groundcover. Liq sty regen.","013",1,"1","Park at the south end of Lee Dr. Walk down trail then cut into woods and across train tracks. Only 240m from the car.",FALSE,NA,250,15,FALSE,26,NA,NA,"Johanna  Fickenscher",2011-10-04 09:48:21,"Camilla  Seirup",2019-08-26 11:16:49,NA
"B6093CC4-75BA-4041-915B-112483CD726D",267605,4244051,38.31447414,-77.65811776,"meters","UTM","18N","NAD83",3.40000009536743,"FRSP_CHWILD","VS",NA,"152",22,"2",NA,FALSE,NA,0,360,FALSE,22,NA,NA,"Evan K Heck",2012-06-13 16:20:05,"Josh J Hamrick",2016-08-23 11:13:59,NA
"B6C96D9D-9EC1-400E-868A-31A9026BF729",343349,4119536,37.2091668,-76.76536895,"meters","UTM","18N","NAD83",1.20000004768372,"COLO_JAMES","VS","Center Tag #40","336",7,"1","Park at the turn out nearest the plot and walk back along the road before cutting into dense pine saplings.",FALSE,NA,0,2,FALSE,26,NA,NA,"Thomas  Faust",2011-10-04 16:46:10,"Josh J Hamrick",2015-08-11 09:18:29,NA
"B6F08C6D-5218-49AE-A9D8-86AEA57B42E3",310343,4410057,39.81935581,-77.21592748,"meters","UTM","18N","NAD83",4.69999980926514,"GETT","VS","Oak-mixed hardwood slope with dense understory. Possible health cut, big bucked log down in plot.","089",20,"2","Access from East Confederate Ave.",FALSE,NA,12,192,FALSE,12,NA,NA,"Camilla  Seirup",2012-06-13 16:20:05,"Camilla  Seirup",2016-08-02 07:55:36,NA
"B7022CDD-E4FC-4C3F-AF67-4D812B48C3A3",307589,4406049,39.78265227,-77.24690642,"meters","UTM","18N","NAD83",0,"GETT","VS","In a health cut, very dense with very tall rubus allegheniensis. Tough plot, best to have more than 2 crew members. 2019 - not the worst plot, rubus covers less than half the plot. Could be improving.","032",12,"1","Park on Confederate ave in parking spaces. Hike in on trail, plot just off trail.",FALSE,NA,242,360,FALSE,23,NA,NA,"Thomas  Faust",2011-08-04 15:05:38,"Camilla  Seirup",2019-07-23 10:46:32,NA
"B7CED23F-C391-406C-B2EE-EF965BA68422",268123,4113803,37.14188279,-77.61067264,"meters","UTM","18N","NAD83",2.5,"PETE_FIVE","VS","loblolly pine; small depression with sphagnum moss; understory mostly smilax and vaccinium","195",14,"3","Plot center moved 20 m east due to a fire road; follow Winthrop trail near parking lot on white oak rd, plot is about 30 m off trail",FALSE,NA,0,360,FALSE,21,NA,NA,"Mary  Short",2012-06-13 16:20:05,"Camilla  Seirup",2017-08-03 13:43:15,NA
"B8EE5247-265F-408D-B8B0-8835834F1BF0",461339,4439049,40.10084771,-75.45358581,"meters","UTM","18N","NAD83",2.29999995231628,"VAFO","VS","Betula lenta canopy, open subcanopy. Mostly mic vim ground cover.","243",33,"4","Parked on side of one-way road (West Line). Walked ~100 meters over ridge to plot.",FALSE,NA,300,127,FALSE,12,NA,NA,"{353252D0-B835-48BC-A821-80E2FA5A55C5}",2010-09-01 12:29:11,"Camilla  Seirup",2018-07-25 13:01:47,NA
"B8F77A1D-CE10-4FD5-8C43-0CCAC05D5A63",695665,4138594,37.37346159,-78.79021581,"meters","UTM","17N","NAD83",NA,"APCO","VS","Very dense regen, sparse ground cover.","010",4,"1","Walk south along Union cavalry trail and cut in at about 30m from plot.",FALSE,NA,90,6,FALSE,23,NA,NA,"Thomas  Faust",2011-08-19 11:03:33,"Camilla  Seirup",2015-08-05 12:22:06,NA
"B9257E71-A6CC-44B2-A1FD-8E1D9ED4B628",693868,4139233,37.37959461,-78.8103296,"meters","UTM","17N","NAD83",NA,"APCO","VS","Quercus phellos/ Pinus taeda canopy, mixed hardwood subcanopy. Some seedlings and sedge groundcover.","011",3,"1","Drive down park road and take left fork at field. Drive down to the maintenance area and park in the shade. Should be about 300m from the plot.",FALSE,NA,218,2,FALSE,19,NA,NA,"Thomas  Faust",2011-08-19 08:44:41,"Brock-Montgomery R Devon",2019-07-29 12:58:31,NA
"B9A36F78-0DDB-4E6D-88B2-EB13F19BE955",307117,4411757,39.83393525,-77.25409278,"meters","UTM","18N","NAD83",3.79999995231628,"GETT","VS","Very open plot, with small temp stream. Rosa and vib pru make parts of plot dense.2016 -Had to reset plot center using trees (again). Placed a fiberglass stack and rebar at the base of 3139 and a rebar 5m meters away at 74 degrees. If you strap out a tape between the two new stakes, plot center should be at 2.25m from tree 3139 and 3.75m from the other stake on the other side of the stream. Plot center is marked by a thin rebar (no center cap) and a white stake but we anticipate it being washed out again as it is in a temporary stream bed. BR is just sticking out from under a log.","097",22,"2","Near Indiana monument.",FALSE,NA,0,360,FALSE,21,NA,NA,"Jesse S Wheeler",2012-06-13 16:20:05,"Mikayla A Bittner",2016-08-03 11:40:03,NA
"BAAA34D1-C7AE-417C-B0D7-1A8AB7803302",626790,4527088,40.88506173,-73.49505393,"meters","UTM","18N","NAD83",3.5,"SAHI","VS","Changed plot orientation from 360 to 4 deg. (2013).  Fairly open canopy from recently dead trees.  Moderately dense understory of shrubs and vines.","236",2,"3","Walk on loop trail behind museum; Plot is about 45 meters to right of trail (after fork)",FALSE,NA,197,4,FALSE,22,NA,NA,"Jesse S Wheeler",2012-06-13 16:20:05,"Jesse S Wheeler",2013-09-16 11:44:15,NA
"BBC3ACA3-792B-41B0-9E14-8C1F0B913B0E",297591,4162805,37.59007029,-77.29255046,"meters","UTM","18N","NAD83",3.59999990463257,"RICH","VS","Mixed hardwood with sparse understory. 2013- changed orientation from 10 to 20 degrees","203",30,"3","Take trail; plot at 280 degrees from trail.",FALSE,NA,174,20,FALSE,12,NA,NA,"Camilla  Seirup",2012-06-13 16:20:05,"Camilla  Seirup",2013-08-15 08:56:27,NA
"BBEFFE03-70DC-4F8F-B9B1-521885AF600E",286853,4236053,38.24723952,-77.43574404,"meters","UTM","18N","NAD83",3.20000004768372,"FRSP_FRED","VS","Oak forest with moderate number of saplings.  Understory relatively thin, not many shrubs.
Changed plot orientation from 40 to 45 deg. To more accurately represent plot layout. (2013)","213",20,"3","Park at end of South Lee Drive.  Hike in at 200 deg. About 100m.",FALSE,NA,222,45,FALSE,12,NA,NA,"Jesse S Wheeler",2012-06-13 16:20:05,"Jesse S Wheeler",2013-08-19 08:13:35,NA
"BDCD838C-5587-4609-BA80-BB5DAC0D96F3",693890,4138983,37.3773382,-78.81014679,"meters","UTM","17N","NAD83",2.40000009536743,"APCO","VS","Virginia Pine and mixed hardwood canopy with sparse understory.","187",21,"3","Park in field, walk in approximately 250 meters.

*Note: Some stumps around plot.",FALSE,NA,323,143,FALSE,21,NA,NA,"Camilla  Seirup",2012-06-13 16:20:05,"Camilla  Seirup",2013-08-06 08:32:00,NA
"BE67A817-BF5B-469D-8F9F-C7FEC82B2B17",322108,4267292,38.53626568,-77.04102187,"meters","UTM","18N","NAD83",2.09999990463257,"THST","VS","Fence runs through BR of plot.","292",5,"4","Park on access rd.  Enter from north end of park.  Walk approx. 200 m NW.  Plot located on north side of creek bank.",FALSE,NA,160,343,FALSE,22,NA,NA,"{8330C84C-E3CB-45E0-99A3-133519C3A7AD}",2010-09-08 16:33:31,"mary  short",2014-08-26 10:54:34,NA
"BE8BFA13-A167-411C-8768-20BA33D156C0",291097,4122784,37.22818445,-77.35473252,"meters","UTM","18N","NAD83",3.09999990463257,"PETE_EAST","VS","mixed hardwood and loblolly; old dry well in plot; cut trees","192",20,"3","Note: Plot moved 20 meters south due to a fire road",FALSE,NA,152,4,FALSE,19,NA,NA,"Mary  Short",2012-06-13 16:20:05,"Mary  Short",2013-09-09 17:00:40,NA
"BFC7A15C-7FD0-43DB-9572-5F2A0813FE10",364086,4122300,37.23732493,-76.53226049,"meters","UTM","18N","NAD83",1.70000004768372,"COLO_YORK","VS","Decent amount of holly regeneration, bare herbaceous layer.","352",33,"2","Park at subdivision, hike in 200m or so.",FALSE,NA,70,244,FALSE,23,NA,NA,"Jesse S Wheeler",2012-08-21 08:15:00,"Josh J Hamrick",2016-08-15 08:08:28,NA
"C064C530-8E3F-41EF-9E18-EB2515F7B193",271590,4234299,38.22769968,-77.60943606,"meters","UTM","18N","NAD83",4.5,"FRSP_SPOT","VS","Pinus taeda canopy with mixed hardwood regen.","232",18,"3","Follow trail for about 200 meters, then walk and additional 100 meters off-trail to plot",FALSE,NA,343,163,FALSE,21,NA,NA,"Camilla  Seirup",2012-06-13 16:20:05,"Camilla  Seirup",2013-09-18 08:20:49,NA
"C1074BF9-41B2-40B1-97C7-D4F5399074D9",283845,4237046,38.25546235,-77.47039158,"meters","UTM","18N","NAD83",4,"FRSP_FRED","VS",NA,"117",12,"2",NA,FALSE,NA,344,166,FALSE,12,NA,NA,"Camilla  Seirup",2012-06-13 16:20:05,"Camilla  Seirup",2012-09-05 12:31:58,NA
"C13B74FE-2801-4684-9DAC-D88D74B652CC",322850,4266042,38.52515574,-77.03219678,"meters","UTM","18N","NAD83",2.40000009536743,"THST","VS","moderate slope with Tulip poplar canopy and New York fern understory.  Changed plot orientation from 192 to 194 degrees to better reflect plot layout (2013).","217",4,"3","park on road along park boundary. Plot about 230 m from road. Plot at bottom of ravine, across ditch/stream canal. Or hike in from VC (500ish meters). Take trail to second field them hike through forest (easy bushwack but steep ravines at times.",FALSE,NA,284,194,FALSE,22,NA,NA,"Jesse S Wheeler",2012-06-13 16:20:05,"Dave A Reynolds",2017-08-24 10:39:16,NA
"C1503A1B-6751-4BE3-B062-055ED55078B1",435096,4451552,40.21186944,-75.76271753,"meters","UTM","18N","NAD83",2.5,"HOFU","VS","Rocky forest floor with lots of moss and mixed hardwoods. 2014- evidence of fire: charred logs and burn scars on some trees.","251",16,"4","Park 180m away south of plot in NE corner of field.",FALSE,NA,176,356,FALSE,29,NA,NA,"{501A76CE-EBF1-4C9C-84CE-9054EF60994B}",2010-09-27 07:29:16,"Camilla  Seirup",2014-07-21 12:50:28,NA
"C22652C0-81C6-4503-842C-A669D0D19B11",267602,4113054,37.1350089,-77.61630052,"meters","UTM","18N","NAD83",2.29999995231628,"PETE_FIVE","VS","Pinus taeda/ Que alb canopy, vacc understory. 2014 - changed orientation from 360 to 3 degrees","271",23,"4","~63 m @ 300 degrees from parking lot auto tour 1",FALSE,NA,0,3,FALSE,21,NA,NA,"{1E30DBBB-8860-48D4-95EC-A8F90A7ED26B}",2010-09-28 09:35:44,"Camilla  Seirup",2014-09-10 14:28:43,NA
"C228BDFD-6CEF-40FC-9630-BF1E7A59BB58",290597,4123801,37.2372318,-77.36064982,"meters","UTM","18N","NAD83",NA,"PETE_EAST","VS","Mircostegium ground cover. Paint facing away from trail. Mixed hardwood canopy. Lots of fresh cwd.","021",4,"1","Walk in 500 meters along trail off tour rd. Plot right up against park boundary.",FALSE,NA,270,13,FALSE,26,NA,NA,"Camilla  Seirup",2012-06-13 16:20:05,"Camilla  Seirup",2015-09-02 14:11:34,NA
"C4998350-F6A8-4FDA-94E6-8E131F404C9D",693940,4137984,37.36832949,-78.8098442,"meters","UTM","17N","NAD83",3.09999990463257,"APCO","VS","Young mixed hardwood forest in a smilax thicket. Smilax is quite dense in parts of the plot.","098",11,"2","Park at first parking lot on the right as you enter the park. Walk across field and then 300m through forest with pathchy dense smilax to plot.",FALSE,NA,158,338,FALSE,26,NA,NA,"Evan K Heck",2012-06-13 16:20:05,"Camilla  Seirup",2016-08-10 08:24:52,NA
"C4CD9F1D-EBEF-4418-8A42-FF8B9FFA2F39",308602,4407302,39.79416173,-77.23545073,"meters","UTM","18N","NAD83",2.70000004768372,"GETT","VS","Dense saplings w/ oaks make up canopy. Park at the intersection of Sykes and wheatfield.","091",21,"2"," Park at the intersection of Sykes and wheatfield.",FALSE,NA,270,110,FALSE,12,NA,NA,"Camilla  Seirup",2012-06-13 16:20:05,"Camilla  Seirup",2016-08-01 10:27:44,NA
"C55DCD6C-EB0E-44D9-A8AF-27F9A3E14372",301353,4145299,37.43321883,-77.24524072,"meters","UTM","18N","NAD83",2.90000009536743,"RICH","VS","loblolly pine plantation with sparse understory","314",36,"4","Turn onto Western Run Rd north of the park, then take an immediate left onto small side street (Chesley Rd), park at deadend. Walk about 500m southwest through park to plot.",FALSE,NA,196,16,FALSE,21,NA,NA,"{501A76CE-EBF1-4C9C-84CE-9054EF60994B}",2010-09-22 12:51:26,"mary  short",2014-08-27 11:18:59,NA
"C8324FB1-8575-4B59-BA92-35AFD65BA6E6",260093,4244291,38.3146567,-77.74403129,"meters","UTM","18N","NAD83",3.20000004768372,"FRSP_CHWILD","VS","oaky canopy, very sparse understory","287",48,"4","park at picnick area, walk along trail. Walk NE for 200m off trail to plot. Orientation changed to 358 from 360",FALSE,NA,180,358,FALSE,21,NA,NA,"{501A76CE-EBF1-4C9C-84CE-9054EF60994B}",2010-09-27 14:25:47,"Ana R Casillas",2014-09-15 16:30:05,NA
"C84AA837-D2B0-4CCC-8346-04447E47B804",268445,4241110,38.28821421,-77.64755624,"Meters","UTM","18N","NAD83",2.70000004768372,"FRSP_CHWILD","BN","Stake of BR place at 13.64 (1/2 meter before 14.14) because of downed tree in way. Added '5' to beginning of plot number to denote Bonus Plot","5157",NA,"2","Park at Catharine's furnace parking lot, hike about 70 m SE.",FALSE,NA,0,360,FALSE,26,NA,NA,"Jesse S Wheeler",2010-07-01 15:49:58,"Jesse S Wheeler",2012-09-20 08:06:23,NA
"C86ADC63-F8FA-47B6-955D-ECF4A4F49323",NA,NA,NA,NA,"meters","UTM","18N","NAD83",NA,"GETT","VS",NA,"",3,NA,NA,TRUE,NA,NA,360,FALSE,NA,NA,NA,NA,2012-06-13 16:20:05,NA,2012-06-13 16:20:05,NA
"C8A966D2-EAE0-4F22-9C59-126EC07504A1",261869,4242545,38.29941214,-77.72315069,"meters","UTM","18N","NAD83",4.59999990463257,"FRSP_CHWILD","VS","Oak heath. Social trail through plot.","151",18,"2","Just off trail through the wilderness. Park at Forest Trail rd and walk back along Orange Plank to get to trail head.",FALSE,NA,210,360,FALSE,22,NA,NA,"Camilla  Seirup",2012-06-13 16:20:05,"Camilla  Seirup",2016-09-01 13:42:37,NA
"C8EEFE8F-C78C-4ABF-83D5-C480CE9D959A",284351,4236549,38.25110885,-77.46446233,"meters","UTM","18N","NAD83",2.29999995231628,"FRSP_FRED","VS","Trash and what looks like earthworks in and surrounding the plot. Plot center is under a piece of CWD near Tree 13264","112",9,"2","Walk trail from S. Lee drive.  Hike West about 150m.  Mine rd. is visible from plot and could be approached from that route as well.",FALSE,NA,30,210,FALSE,12,NA,NA,"Jesse S Wheeler",2012-06-13 16:20:05,"Camilla  Seirup",2016-08-18 17:01:16,NA
"CA4D9ABF-CE57-4F5D-8556-F931B5098376",482383,4215963,NA,NA,"meters","UTM","18N","NAD83",4,"ASIS","VS","Pinus taeda overstory and morella cerifera understory. TOX RAD ON 32/47 TREES. IN EVERY QUAD. SAVE YOURSELVES. (bring gloves and technu)","388",794,"1","Park at 27-28km on beach and walk in attempting to find a pony path to cut through brush",FALSE,NA,0,360,FALSE,19,NA,NA,"Tandena  Wagner",2019-09-11 12:39:42,"Camilla  Seirup",2019-09-19 10:17:43,NA
"CA5A2146-CC42-4E12-BF1A-8C7223919B97",344349,4118785,37.20256777,-76.7539477,"meters","UTM","18N","NAD83",4,"COLO_JAMES","VS","GRTS 26 original location did not work, rejected North and East alternates. Plot set at southern alternate location. Half of plot mostly shrub cover, other half Nyssa  and Pinus taeda, sparse canopy.","375",27,"4","Park at pull out just after fork. Walk in 50m, plot just before wetland. Plot center tag # 14741.",FALSE,NA,0,360,FALSE,26,NA,NA,"Camilla  Seirup",2014-08-12 08:21:32,"Camilla  Seirup",2018-08-13 10:18:37,NA
"CADB5192-4F00-413A-A178-1720E415CBA8",289839,4145547,37.43290943,-77.37535074,"meters","UTM","18N","NAD83",3,"RICH","VS","Sparse heath understory.  Canopy gap near UL of plot.","154",16,"2","About 60m west of auto road.  Maybe 100m south of yellow house. Park address: 8621 Battlefield Rd, Henrico, VA 23231",FALSE,NA,0,340,FALSE,19,NA,NA,"Jesse S Wheeler",2012-06-13 16:20:05,"Camilla  Seirup",2016-08-24 08:41:30,NA
"CBFDCFDA-956E-4AE1-A9F5-8FBADBF0DFDA",273347,4232547,38.21237023,-77.5888231,"meters","UTM","18N","NAD83",1.5,"FRSP_SPOT","VS","mixed hardwood and pine with sparse understory","291",23,"4","Parked on edge of park road, then hiked southwest for ~200m alond park boundary",FALSE,NA,85,278,FALSE,21,NA,NA,"{1E30DBBB-8860-48D4-95EC-A8F90A7ED26B}",2010-09-07 16:54:58,"mary  short",2014-08-19 11:27:09,NA
"CD15E3C1-F3A8-4E93-AB0D-667F47710F69",261100,4243550,38.30825492,-77.73227498,"meters","UTM","18N","NAD83",0,"FRSP_CHWILD","VS","White oak canopy, with carpinus and ilex subcanopy. Vaccinium and lycopodium groundcover.","061",11,"1","If taking the trail, park at the south end or at the Ewell picnic area. There is no trailhead on Rt 20. It is about a 2km walk from the south end of the trail to plot.",FALSE,NA,260,7,FALSE,23,NA,NA,"Johanna  Fickenscher",2011-09-07 16:48:17,"Camilla  Seirup",2015-09-14 08:57:37,NA
"CD373C8F-2A40-403B-8699-F792D3426004",300100,4144051,37.42170861,-77.25905497,"meters","UTM","18N","NAD83",0,"RICH","VS","No rebar in corners or micro, only white stakes. Plot is on a slope, microstegium and ferns groundcover. Mixed hardwood canopy.","015",4,"1","Park on Carter Mill Rd by field. Walk in on rd through field then bushwack to plot.",FALSE,NA,60,358,FALSE,22,NA,NA,"Johanna  Fickenscher",2011-10-03 10:26:43,"Kate M Ortenzi",2015-09-22 08:02:17,NA
"CDACE106-C3F1-4885-97A2-8A560E17DD42",259598,4245312,38.3237152,-77.75003447,"meters","UTM","18N","NAD83",1.60000002384186,"FRSP_CHWILD","VS","Acidic oak/ hickory, sparse understory. Old NPS park boundary pole in plot.","285",46,"4","Take trail behind exhibit shelter, then turn right onto bridle path. At hiking trail and bridle path interesection 550m from plot (just after plot 284), take social trails directly to plot, easy walking.",FALSE,NA,0,360,FALSE,21,NA,NA,"{501A76CE-EBF1-4C9C-84CE-9054EF60994B}",2010-09-28 09:34:59,"Casey  Croshaw",2018-08-23 10:20:09,NA
"CDBAF493-2300-497D-8778-D240FD85676D",460100,4437298,40.0850145,-75.46801372,"meters","UTM","18N","NAD83",5,"VAFO","VS","Changed orientation from 345 to 350","076",11,"2",NA,FALSE,NA,150,350,FALSE,12,NA,NA,"{1E30DBBB-8860-48D4-95EC-A8F90A7ED26B}",2010-10-04 15:10:53,"Josh J Hamrick",2016-07-28 08:53:07,NA
"CDC60024-1826-4812-BA33-5F2448F66870",286603,4236554,38.25169138,-77.43874936,"meters","UTM","18N","NAD83",2.79999995231628,"FRSP_FRED","VS","mixed hardwood with moderately sparse understory, patch of microstegium in BL corner of plot","277",29,"4","park on lee drive, plot 100m from road",FALSE,NA,0,360,FALSE,21,NA,NA,"{501A76CE-EBF1-4C9C-84CE-9054EF60994B}",2010-09-28 12:03:31,"mary  short",2014-08-26 15:29:12,NA
"CE598BF4-D463-47DA-9E27-14733A118510",268851,4242796,38.30349762,-77.64346972,"meters","UTM","18N","NAD83",0,"FRSP_CHWILD","VS","Gaylussacia cover, oak canopy, fairly open, probably better as a morning plot.","049",6,"1","Park on Slocum Dr. at tour stop 7. 130m bushwack to plot.",FALSE,NA,300,4,FALSE,21,NA,NA,"Johanna  Fickenscher",2011-09-08 17:09:02,"Devon R Brock-Montgomery",2019-08-27 07:43:56,NA
"CE8CC4C3-235E-4639-9933-AF5E9D4BB4FE",367343,4120558,37.22209713,-76.49524339,"meters","UTM","18N","NAD83",2.29999995231628,"COLO_YORK","VS","Microstegeum ground cover.  Some large fallen tulip poplars","346",34,"2","About 60m off tour rd.",FALSE,NA,0,360,FALSE,21,NA,NA,"Jesse S Wheeler",2012-08-16 16:56:18,"Jesse S Wheeler",2012-08-20 11:38:08,NA
"CF401DAE-2470-4F7B-8D74-42E00E1C7E49",290605,4123299,37.23271238,-77.36041866,"meters","UTM","18N","NAD83",4.30000019073486,"PETE_EAST","VS","Mixed hardwood canopy. Many felled pines. All appear to be cut down at the same time.  This was incorrectly assigned to Panel 4, reassigned to Panel 3 (mjj)","369",33,"3","Park on Seige Rd. Walk 75m to plot.",FALSE,NA,280,90,FALSE,12,NA,NA,"Camilla  Seirup",2013-09-11 13:55:16,"Camilla  Seirup",2013-09-11 13:55:30,NA
"D05758CD-714D-45AC-A38B-6C9D2F1A3AF3",307849,4406045,NA,NA,"meters","UTM","18N","NAD83",5.90000009536743,"GETT","VS",NA,NA,38,NA,"DATE: 08/03/2009
Too close to park boundary line and perennial stream. Plot center fell outside of park boundary by about 8 meters

Reason for Exclusion:
1.) Plot Center is <15m from:Park Boundary
2.) Plot Center is <15m from:Perennial Stream",TRUE,NA,NA,NA,FALSE,NA,NA,NA,NA,2012-06-13 16:20:05,NA,2012-06-13 16:20:05,NA
"D05FEA66-3DCA-4E56-94BE-E89F78A623EA",286099,4236800,38.25378663,-77.4445786,"meters","UTM","18N","NAD83",1.29999995231628,"FRSP_FRED","VS","Oak forest with sparse understory","202",16,"3","Park on Lee Dr. and walk 220m to plot.",FALSE,NA,76,256,FALSE,21,NA,NA,"Jesse S Wheeler",2012-06-13 16:20:05,"Jesse S Wheeler",2013-08-19 10:49:36,NA
"D1089791-9C08-4C85-B8DA-B4B8EED68F8D",310104,4409815,39.81712365,-77.21864786,"meters","UTM","18N","NAD83",3.70000004768372,"GETT","VS","Mixed hardwood canopy, dense fraxinus sapling regen.","258",62,"4","Take Slocum Ave, park 50m from plot at 2nd Maryland momument.",FALSE,NA,320,140,FALSE,23,NA,NA,"{501A76CE-EBF1-4C9C-84CE-9054EF60994B}",2010-09-27 11:11:11,"Anna R Casillas",2014-07-28 08:00:32,NA
"D15415BA-687F-452B-BE8F-27A93A5B2872",612827,4107815,37.10986858,-79.73013899,"meters","UTM","17N","NAD83",2.79999995231628,"BOWA","VS","Lir tul/loblolly successional with lots of nyssa sylvatica. 2014 - changed orientation from 280 to 272","261",7,"4","Park on trail.  Hike approximately 70 m at 50. Plot on slope.  Plot upslope from Jack-o-Lantern trail and brook",FALSE,NA,100,272,FALSE,23,NA,NA,"{1E30DBBB-8860-48D4-95EC-A8F90A7ED26B}",2010-08-30 16:30:45,"Camilla  Seirup",2014-08-04 09:20:20,NA
"D19625B4-235D-45A1-A740-651543279893",266099,4114058,37.14367503,-77.6335184,"meters","UTM","18N","NAD83",0,"PETE_FIVE","VS","Vaccinium in understory, Lots of trees: Pinus taeda canopy with Quercus alba growing in.","065",1,"1","Park in White Oak Rd trail parking. Take Pine Hill trail immediately on the left. Walk 500m on trail, then cut in.",FALSE,NA,300,6,FALSE,22,NA,NA,"Thomas  Faust",2011-09-07 13:13:39,"Camilla  Seirup",2015-08-31 09:58:33,NA
