"Location_ID","X_Coord","Y_Coord","Latitude","Longitude","Coord_Units","Coord_System","UTM_Zone","Datum","Est_H_Error","Unit_ID","Loc_Type","Loc_Notes","Plot_Number","GRTS_Order","Panel","Directions","Rejected","Elevation","Aspect","Orientation","Change_Orientation","Physiographic_Class","Terrain_Position","USNVC_Formation","Created_By","Created_Date","Updated_By","Updated_Date","Stand_Origin_Year"
"8B8772C3-20BF-4F3C-937A-0C78C5DEF47D",298854,4159296,37.55874371,-77.27729261,"meters","UTM","18N","NAD83",2.40000009536743,"RICH","VS","center stake flush with ground; all stakes missing (and reset) except bottom micro, bl and uc; br in water; all trees tags also missing; row boats found right outside plot; plot directly adjacent to large swamp; plot mixed hardwood, mesic, possible flood plain; br stake in swamp","219",23,"3","To get to plot you have to cross a large unmapped swamp (2009 crew hiked in from Turkey Hill Trl.)",FALSE,NA,0,2,FALSE,26,NA,NA,"mary  short",2012-06-13 16:20:05,"mary  short",2013-09-20 10:03:12,NA
"8BF05E61-6C30-49AD-9632-4E4871BAFFCE",366106,4120549,37.22183921,-76.50918022,"meters","UTM","18N","NAD83",NA,"COLO_YORK","VS","Center Tag 15119. Paw paw seedlings as groundcover, mixed hardwood and pinus taeda canopy.","338",20,"1","Park on Goosley Rd. There is a pullout near the cemetary which is a little farther from the plot but is safer. Than walk down Goosley rd, walk to end of field and then cut into woods.",FALSE,NA,0,360,FALSE,21,NA,NA,"Thomas  Faust",2011-10-04 11:52:22,"Camilla  Seirup",2015-08-12 08:51:26,NA
"8D4050C0-C589-407A-9442-D22F7B93AA8B",434105,4450558,40.20283752,-75.77426034,"meters","UTM","18N","NAD83",3.29999995231628,"HOFU","VS","Center Tag?","163",9,"3","From visitor's center take dirt road to Administration office. Take left at 1st intersection. Go toward small stream with wooden bridge and cross bridge. Go through unlatched gate. Take right at first intersection after gate. Follow road until it dead ends in parking lot for residence.",FALSE,NA,41,225,FALSE,22,NA,NA,"Jesse S Wheeler",2012-06-13 16:20:05,"Jesse S Wheeler",2013-07-24 13:36:22,NA
"8E202247-6C51-41EE-878A-404FE4650565",307350,4406050,39.78260722,-77.24969565,"meters","UTM","18N","NAD83",1.5,"GETT","VS","Near health cut, southern half of plot in sapling regen age.","356",64,"2","Take hiking trail to the south from Confederate rd.  Bushwack about 100m.",FALSE,NA,0,360,FALSE,19,NA,NA,"Jesse S Wheeler",2012-08-09 07:52:11,"Jesse S Wheeler",2012-08-09 08:01:02,NA
"8F792970-6254-419E-A46B-71C14D1116AD",367354,4120049,37.21751209,-76.49502889,"meters","UTM","18N","NAD83",2.5,"COLO_YORK","VS","Center Tag #1149. Center tag not located but stake was located 8/6/19. Center tag # now 12260. Pine and Tulip poplar overstory with Prunus serotina and Liriodendron tulipifera midstory. Ilex opaca subacnopy with low ground cover","332",23,"1","Park on historical tour road in pull-out just after the field and interp sign. Walk down road about 50 m to join social trail. Follow social trail for about 400m, then turn West, plot is about 125m west of social trail.",FALSE,NA,180,360,FALSE,21,NA,NA,"Thomas  Faust",2011-10-04 09:22:15,"Sam A Bietsch",2019-08-06 11:48:28,NA
"90C19A74-7E0B-4936-8370-00AA9BE0954C",462347,4437299,40.08512699,-75.44165798,"meters","UTM","18N","NAD83",0,"VAFO","VS","Center Tag #1149","037",1,"1","Park at either Anthony Wayne statue (horse) and walk 300m through field to forested area, or park along 252 at trail head and take trail into forest to plot.",FALSE,NA,0,360,FALSE,21,NA,NA,"Johanna  Fickenscher",2011-08-03 17:17:59,"Brock-Montgomery R Devo",2019-07-16 11:42:46,NA
"9153F007-0809-42FB-B041-48E728847E45",258848,4245296,38.32336975,-77.75859931,"meters","UTM","18N","NAD83",2.5,"FRSP_CHWILD","VS","Mixed hardwood, large canopy gap with mid story regen. Sparse groundcover. 2014 - changed orientation from 360 to 257 degrees.","284",39,"4","~ 80m at 340 degrees off of the trail. 30 m off bridle path.",FALSE,NA,180,257,FALSE,21,NA,NA,"{1E30DBBB-8860-48D4-95EC-A8F90A7ED26B}",2010-09-27 14:47:32,"Camilla  Seirup",2014-08-21 10:43:10,NA
"91F278A8-4F90-43A4-AF06-BBFFFD1CF95E",272120,4233303,38.21886688,-77.60306716,"meters","UTM","18N","NAD83",2.40000009536743,"FRSP_SPOT","VS",NA,"145",10,"2",NA,FALSE,NA,0,360,FALSE,22,NA,NA,"Camilla  Seirup",2012-06-13 16:20:05,"Josh J Hamrick",2016-08-23 09:53:45,NA
"92D78A4D-3D5F-40E3-A52A-E7DD6876DE71",268107,4243048,38.30557433,-77.65205252,"meters","UTM","18N","NAD83",3,"FRSP_CHWILD","VS",NA,"125",25,"2",NA,FALSE,NA,44,224,FALSE,12,NA,NA,"Thomas  Faust",2012-06-13 16:20:05,"Thomas  Faust",2012-08-29 08:29:02,NA
"9304F097-8E13-4F84-BA69-B8A64A65641E",NA,NA,NA,NA,"meters","UTM","18N","NAD83",NA,"VAFO","VS",NA,"",9,NA,NA,TRUE,NA,NA,360,FALSE,NA,NA,NA,NA,2012-06-13 16:20:05,NA,2012-06-13 16:20:05,NA
"930E4FD9-4DCC-4358-BD39-C43A2FE0A1FD",308845,4408550,39.80545242,-77.23297817,"meters","UTM","18N","NAD83",1.29999995231628,"GETT","VS","Swamp white oak overstory (some health cut) with rubus, lots of rosa, shrubs and tall seedling understory.","255",50,"4","Park Behind Maintenance building and walk southeast ~ 150 m. Changed orientation from 360 to 7 7/29/2014",FALSE,NA,0,7,FALSE,21,NA,NA,"{1E30DBBB-8860-48D4-95EC-A8F90A7ED26B}",2010-09-27 08:50:55,"Camilla  Seirup",2018-07-31 15:25:37,NA
"935C1748-FDE9-4C7E-8FDD-A3E946F0C6E9",290852,4124552,37.24405287,-77.35798818,"meters","UTM","18N","NAD83",2.20000004768372,"PETE_EAST","VS","Sweetgum midstory, Loblolly overstory.","139",14,"2","About 70m west of the Visitor Center.",FALSE,NA,0,360,FALSE,21,NA,NA,"Jesse S Wheeler",2012-06-13 16:20:05,"Jesse S Wheeler",2012-09-10 15:14:14,NA
"93C2789D-59BE-47FB-B051-3E7085E0AD9E",285600,4237050,38.25591878,-77.45035227,"meters","UTM","18N","NAD83",NA,"FRSP_FRED","VS","sparse groundcover, Oak canopy, ilex subcanopy. UL micro is set at 313 degrees for some reason. 2015 crew decided not to move it.","002",8,"1","Park on Lee drive. Short, easy bushwack",FALSE,NA,0,360,FALSE,21,NA,NA,"Camilla  Seirup",2012-06-13 16:20:05,"Camilla  Seirup",2015-08-13 11:36:56,NA
"940E002C-A332-4F49-92C3-C7274B350F3F",309851,4408809,39.80800978,-77.22130999,"meters","UTM","18N","NAD83",2.29999995231628,"GETT","VS","mixed hardwood canopy with thick barberry and lindera understory. Difficult to shoot angles due to thick understory.","171",45,"3","Directions:
Park at Waypoint P171 (it's a large turn-out across the street from 2151 Penna Cavalry (handwriting not clear)  Memorial;  
 Follow field edge until you reach a bridge; Follow trail until about 40 meters to plot",FALSE,NA,324,141,FALSE,22,NA,NA,"Camilla  Seirup",2012-06-13 16:20:05,"Camilla  Seirup",2013-07-29 09:54:08,NA
"9439C1EA-D50B-4280-B351-52CF64EA2DBB",266104,4113575,37.13932703,-77.63331129,"meters","UTM","18N","NAD83",2.79999995231628,"PETE_FIVE","VS",NA,"110",8,"2",NA,FALSE,NA,0,360,FALSE,21,NA,NA,"{1E30DBBB-8860-48D4-95EC-A8F90A7ED26B}",2010-10-04 13:51:30,"Josh J Hamrick",2016-09-13 11:15:32,NA
"95C04650-8D72-4DD2-A901-6C9E72369362",322355,4265799,38.52286853,-77.03781016,"meters","UTM","18N","NAD83",2.40000009536743,"THST","VS","Sparse mic vem and sedge understory, Asimina and Ilex mid, mixed hardwood canopy","325",7,"1","Walk South from visitor center ~800m.  Plot on a slope, ~20m from power line cut.",FALSE,NA,250,70,FALSE,23,NA,NA,"Johanna  Fickenscher",2011-10-03 08:43:40,"Sam A Bietsch",2019-09-04 12:19:44,NA
"96D97888-6810-43B8-A7E2-72D6E284F32F",463355,4440555,40.11450605,-75.4300194,"meters","UTM","18N","NAD83",1.89999997615814,"VAFO","VS","cap for plot center was  missing but rebar is still in ground, added another piece of bent rebar with flagging. Found cap scattered on plot and put back into center.","156",26,"3",NA,FALSE,NA,132,358,FALSE,22,NA,NA,"Emilie  Schuler",2012-06-13 16:20:05,"Danielle  Bara",2017-07-20 11:46:51,NA
"971BB31B-34A9-49D9-A39A-FDA4622BB1F1",694106,4139503,37.38197677,-78.80757244,"meters","UTM","17N","NAD83",2.79999995231628,"APCO","VS",NA,"262",25,"4","Two drainages at 5ft deep run to the right and left of plot center",FALSE,NA,310,130,FALSE,23,NA,NA,"{1E30DBBB-8860-48D4-95EC-A8F90A7ED26B}",2010-09-27 09:39:30,"{1E30DBBB-8860-48D4-95EC-A8F90A7ED26B}",2010-09-27 09:41:17,NA
"97766CA4-4BDC-4415-97A5-62C7DD589A81",285603,4236549,38.25140837,-77.45016644,"meters","UTM","18N","NAD83",3.20000004768372,"FRSP_FRED","VS","Some huckleberry understory, pretty open mid-story. Changed plot orientation from 187 to 170.","114",11,"2","Park on S. Lee drive.  Hike SW about 300m",FALSE,NA,10,170,FALSE,12,NA,NA,"Jesse S Wheeler",2012-06-13 16:20:05,"Camilla  Seirup",2016-08-18 13:19:45,NA
"98CD7D88-9873-4A97-8A93-DD3569D4F67C",284348,4237075,38.25584432,-77.46465664,"meters","UTM","18N","NAD83",2.20000004768372,"FRSP_FRED","VS","Fair amount of CWD, mixed canopy and sparse heath understory.  Changed orientation from 360 to 359 (2013).","200",19,"3","Plot moved 20 meters north because too close to road",FALSE,NA,0,359,FALSE,21,NA,NA,"Jesse S Wheeler",2012-06-13 16:20:05,"Jesse S Wheeler",2013-08-28 15:14:54,NA
"99241065-E06A-407C-8447-2D4834F885A7",268095,4243550,38.3100906,-77.65235432,"meters","UTM","18N","NAD83",2.20000004768372,"FRSP_CHWILD","VS","Deposit of trash/glass items right outside of plot.
BR corner stake offset to 12.5 HD due to tree.
Oak and hickory with sparse understory","221",28,"3","park on tour road (across rt 3 from vistors center) hike trail 70m to plot",FALSE,NA,0,355,FALSE,21,NA,NA,"mary  short",2012-06-13 16:20:05,"mary  short",2013-08-22 12:43:01,NA
"99BD221E-A4ED-4398-9F48-7E10E0B80156",268099,4115058,37.15317789,-77.61133139,"meters","UTM","18N","NAD83",NA,"PETE_FIVE","VS","pine overstory, oak midstory, sparse vaccinium understory.","103",9,"2","Drive to end of rd., then hike about 450m east, skirting wetland.",FALSE,NA,70,240,FALSE,23,NA,NA,"Jesse S Wheeler",2012-06-13 16:20:05,"Jesse S Wheeler",2012-09-12 08:54:27,NA
"9A04AC35-3BCE-4DBD-8CDD-C024BF02FF64",365860,4117796,37.19699667,-76.51145714,"meters","UTM","18N","NAD83",4.09999990463257,"COLO_YORK","VS","loblolly pine and red maple dominated; temporary stream through plot (possibly permanent?) 2017 - visited plot after heavy rain, stream very full.","359",46,"3","Access French Loop from Surrender Field, park at fire road after field and walk about 600m down fire road, 50m off fire road (right side)",FALSE,NA,0,360,FALSE,26,NA,NA,"mary  short",2013-08-12 09:07:22,"Camilla  Seirup",2017-08-08 09:26:19,NA
"9A1E3EAA-440A-41D6-9F41-FDC0D5277570",NA,NA,NA,NA,"meters","UTM","18N","NAD83",NA,"VAFO","VS",NA,"",2,NA,NA,TRUE,NA,NA,360,FALSE,NA,NA,NA,NA,2012-06-13 16:20:05,NA,2012-06-13 16:20:05,NA
"9AE63D27-10E4-4E73-9021-E9F07237293B",694586,4139783,37.38439817,-78.80208084,"meters","UTM","17N","NAD83",3.40000009536743,"APCO","VS","plot has small creek bed running through bottom.  Not very shrubby. Changed orientation from 270 to 280.","099",9,"2","Park near employee housing and bushwack north about 350m",FALSE,NA,90,280,FALSE,29,NA,NA,"Jesse S Wheeler",2012-06-13 16:20:05,"Mikayla A Bittner",2016-08-08 11:45:59,NA
"9D46AFD5-A76B-4468-AD39-279770D414DD",269350,4243551,38.3104232,-77.63801501,"meters","UTM","18N","NAD83",2.40000009536743,"FRSP_CHWILD","VS","Oak heath","128",23,"2","Park at parking lot just before Rt. 3. follow trail through field and into woods to plot. Plot is at field edge",FALSE,NA,0,338,FALSE,19,NA,NA,"Thomas  Faust",2012-06-13 16:20:05,"Camilla  Seirup",2016-08-29 13:50:50,NA
"9DC14C51-E9D9-4130-B3F7-DB00611E8382",NA,NA,NA,NA,"meters","UTM","18N","NAD83",NA,"PETE_FIVE","VS",NA,"",5,NA,NA,TRUE,NA,NA,360,FALSE,NA,NA,NA,NA,2012-06-13 16:20:05,NA,2012-06-13 16:20:05,NA
"9E9FBE8E-7CD7-4226-B3D2-4DF1D5062493",290852,4123795,37.23723501,-77.35777568,"meters","UTM","18N","NAD83",2,"PETE_EAST","VS","mixed hardwood with sparse understory with microstegium","191",19,"3","Park on tour road at tour stop #2, and walk over/around earthworks to plot.",FALSE,NA,0,360,FALSE,11,NA,NA,"Mary  Short",2012-06-13 16:20:05,"Mark  Johnson",2017-08-14 15:53:08,NA
"9EB76221-AD72-42F2-964E-C5AA68B961DA",289104,4162566,37.58601222,-77.38853316,"meters","UTM","18N","NAD83",1.5,"RICH","VS","Mixed hardwood canopy, mic vim ground cover. 2014 - changed orientation to 230 from 240 degrees.","309",34,"4","Appx. 30 meters from gated road off of highway 360. Or park in park unit parking lot and walk to plot 180m (down bluff and across dirt road)",FALSE,NA,50,230,FALSE,21,NA,NA,"{501A76CE-EBF1-4C9C-84CE-9054EF60994B}",2010-09-22 15:30:40,"Camilla  Seirup",2014-09-11 11:09:41,NA
"9F2E2F44-3FEA-496D-BC0A-F8F14D8EC54F",267097,4113801,37.14160987,-77.62221261,"meters","UTM","18N","NAD83",NA,"PETE_FIVE","VS",NA,"105",11,"2",NA,FALSE,NA,0,360,FALSE,21,NA,NA,"Thomas  Faust",2012-06-13 16:20:05,"Thomas  Faust",2012-09-11 08:26:05,NA
"9F8C491B-AF77-4FB1-B83B-AEC803F9E4DB",321850,4266561,38.52963042,-77.04379392,"meters","UTM","18N","NAD83",4.69999980926514,"THST","VS","lots of spicebush, some sycamore not too tall.  Bottom half of plot transitions to terrace with large tulip poplars","130",2,"2","Hike past little house and through small field, down slope.",FALSE,NA,230,45,FALSE,23,NA,NA,"Jesse S Wheeler",2012-06-13 16:20:05,"Josh J Hamrick",2016-08-25 10:52:31,NA
"A01ABF7E-FAC8-4393-AAB2-906DF75A6FA2",283342,4116809,37.17260429,-77.44034103,"meters","UTM","18N","NAD83",NA,"PETE_EAST","VS","Gaylussacia groundcover, Pinus taeda and mixed hardwood canopy.","023",1,"1","Park in cemetary parking lot off of Flank rd. 27000 Flank Rd, Petersburg VA 23803 should get you pretty close. Plot is in the woods across the street 50m away.",FALSE,NA,300,5,FALSE,21,NA,NA,"Jesse S Wheeler",2011-09-07 14:18:50,"Camilla  Seirup",2017-02-23 16:03:27,NA
"A04BF95E-15D2-4FE3-A4AE-2260A1A94D9C",626913,4527247,40.88647452,-73.49356198,"meters","UTM","18N","NAD83",1.89999997615814,"SAHI","VS","Moderate shrub understory, tulip poplar canopy. Many downed trees.","231",5,"3","Take loop nature trail (north side) right to plot (about 10 m away).",FALSE,NA,64,228,FALSE,22,NA,NA,"Jesse S Wheeler",2012-06-13 16:20:05,"Emilie  Schuler",2013-09-17 07:51:34,NA
"A102B6B6-11C6-468C-8E9F-4878CDFEB9F2",259055,4245527,38.32550486,-77.75631273,"meters","UTM","18N","NAD83",2,"FRSP_CHWILD","Deer","Deer exclosure. Added '6' to beginning of plot number to denote Deer Exclosure Plot","6329",2,"1","Very close to Lake in the Woods community. Park on Mansion Dr (or Rd), it<U+0092>s a dead end. Plot is off of power line cut. Or Park at exhibit shelter and follow Culpepper Mine trail (take first right after field) to plot.",FALSE,NA,315,360,FALSE,22,NA,NA,"Jesse S Wheeler",2011-09-26 15:42:02,"Camilla  Seirup",2015-09-15 12:19:18,NA
"A1BA56F2-1E94-4995-9FAB-C2CE317710DB",434097,4449798,40.19599031,-75.77427644,"meters","UTM","18N","NAD83",3.20000004768372,"HOFU","VS","Vines and shrubs abound, spicebush, wineberry and bittersweet, oh my!","165",12,"3","Hike in from Rt. 345.  Parking spot at Green Ln.",FALSE,NA,61,241,FALSE,22,NA,NA,"Jesse S Wheeler",2012-06-13 16:20:05,"Jesse S Wheeler",2013-07-24 08:50:20,NA
"A2800B3D-4314-4E92-A97A-FE49EDDA8F41",289599,4145047,37.4283519,-77.37791868,"meters","UTM","18N","NAD83",1.89999997615814,"RICH","VS","Mixed hardwood with sparse understory and Liquidambar regeneration (mostly on right side of plot near field edge). Plot tagged away from field. Some debris from treefort in plot.","303",38,"4","Park @ Nat. Res. Office.",FALSE,NA,196,16,FALSE,12,NA,NA,"{501A76CE-EBF1-4C9C-84CE-9054EF60994B}",2010-09-26 18:19:39,"Camilla  Seirup",2018-09-06 12:57:21,NA
"A29753EF-7D71-40DF-8034-260A4FD2803C",479680,4211481,NA,NA,"meters","UTM","18 N","NAD83",2,"ASIS","VS","Pinus taeda overstory with sand and pine duff substrate. Sunny, open site.","387",989,"1","Head to KM 33, take road toward Pope Bay campground past gate. Head North from road where forest opens up with sandy substrate. Easy walking about 400m.",FALSE,NA,180,360,FALSE,19,NA,NA,"Devon R Brock-Montgomery",2019-09-11 08:51:31,"Camilla  Seirup",2019-09-19 10:12:07,NA
"A3B24EFE-0BF9-48B0-96AF-08672CCFC0E1",284099,4236544,38.25100333,-77.46733822,"meters","UTM","18N","NAD83",1.70000004768372,"FRSP_FRED","VS","mixed hardwood with sparse understory","274",30,"4","parked on Lee drive, followed trail until about 300m from plot, sw to plot",FALSE,NA,34,223,FALSE,23,NA,NA,"{1E30DBBB-8860-48D4-95EC-A8F90A7ED26B}",2010-09-28 12:57:07,"mary  short",2014-09-04 12:02:20,NA
"A3B9541C-6649-4F6C-9A69-FAF8AAB476F6",460602,4438320,40.09424571,-75.46218788,"meters","UTM","18N","NAD83",3.59999990463257,"VAFO","VS","slopey plot with tall lir tul canopy and not much in understory.","081",14,"2","Park at head of Horseshoe trail in suburbia and walk in. plot is an easy 200m bushwalk down slope of trail.",FALSE,NA,210,226,FALSE,12,NA,NA,"Evan K Heck",2012-06-13 16:20:05,"Camilla  Seirup",2016-07-26 11:31:24,NA
"A5277607-875D-4B03-B460-91F8FE0E0035",269856,4243047,38.30601572,-77.63206928,"meters","UTM","18N","NAD83",3.09999990463257,"FRSP_CHWILD","VS",NA,"126",19,"2",NA,FALSE,NA,96,274,FALSE,12,NA,NA,"Thomas  Faust",2012-06-13 16:20:05,"Thomas  Faust",2012-08-29 15:53:55,NA
"A5E7C40A-212A-4625-81BC-892195B36607",270095,4243051,38.30611301,-77.62933989,"meters","UTM","18N","NAD83",2.59999990463257,"FRSP_CHWILD","VS","Aspect recorded as 180, but plot is flat so entered as 0; mixed hardwood with sparse understory","281",45,"4","60m @ 220 degrees from road side",FALSE,NA,0,7,FALSE,21,NA,NA,"{8330C84C-E3CB-45E0-99A3-133519C3A7AD}",2010-09-09 17:14:20,"mary  short",2014-09-02 11:00:54,NA
"A5F0366E-F39D-41E5-BA7D-426029068028",307108,4412809,NA,NA,"meters","UTM","18N","NAD83",6,"GETT","VS",NA,NA,41,NA,"GPS accuracy not actually recorded
DATE: 08/05/09
Site is in an open field. The only direciton that is out of the field put the plot in a thin riparian area/stream (not suitable for plot).

Reason for Exclusion:
1.) Plot Center is <15m from:Perennial stream
2.) Plot Habbitat: Site manged as an open field",TRUE,NA,NA,NA,FALSE,NA,NA,NA,NA,2012-06-13 16:20:05,NA,2012-06-13 16:20:05,NA
"A6DE5151-7C8D-40F9-9B40-37C2CE41EE33",266602,4114295,37.1459348,-77.62793439,"meters","UTM","18N","NAD83",2.70000004768372,"PETE_FIVE","VS","Stake angle estimated due to trees: BR, UL, UL regen. 2013 - changed orientation to 157 from 170. Loblolly pine plantation, mixed hardwood regenerating.","196",17,"3","Drive down M trail until no longer passable. Walk 70m down trail, plot is 30m off trail to the right.",FALSE,NA,42,157,FALSE,12,NA,NA,"Camilla  Seirup",2012-06-13 16:20:05,"Camilla  Seirup",2013-09-11 08:44:09,NA
"A723F679-216C-4FA1-84DE-F14356E7CDD3",460353,4438303,40.09408086,-75.46510783,"meters","UTM","18N","NAD83",3.09999990463257,"VAFO","VS"," Mountain laurel understory with mixed oak canopy. 2013- changed orientation from 180 to 177.","161",20,"3","Hike up Horseshoe trail and cut in at 263 degrees and 50m.",FALSE,NA,360,177,FALSE,12,NA,NA,"Camilla  Seirup",2012-06-13 16:20:05,"Camilla  Seirup",2017-07-17 13:14:05,NA
"A76B4F37-998A-40EC-B04A-05141304D8C6",306841,4407290,39.79365576,-77.25600002,"meters","UTM","18N","NAD83",0,"GETT","VS","Oak hickory canopy, large canopy gap due to huge df Q. alba. Oak seedlings, rosa multi, lon jap, and mile-a-minute responding. UL micro in tip-up mound.","031",5,"1","Park on West Confederate Ave just north of Emmitsburg Rd, walk in on hiking trail then cut in 20m to plot.",FALSE,NA,270,3,FALSE,21,NA,NA,"Johanna  Fickenscher",2011-08-03 15:26:14,"Camilla  Seirup",2015-09-18 08:23:47,NA
"A80F0A95-BB8F-44F0-B880-141B2FB40A9F",286355,4236051,38.24710329,-77.44142958,"meters","UTM","18N","NAD83",0,"FRSP_FRED","VS","Sparse understory, Quercus/carya canopy.","008",5,"1","400m walk from Lee drive.",FALSE,NA,198,3,FALSE,21,NA,NA,"Thomas  Faust",2011-08-30 14:32:42,"Camilla  Seirup",2015-08-17 09:41:27,NA
"A82094C4-2AB3-40F1-9A85-82AA26B2B72E",258349,4245549,38.32551288,-77.76438793,"meters","UTM","18N","NAD83",0,"FRSP_CHWILD","VS","Oak/hickory, sparse understory.","055",7,"1","If taking trail, park at exhibit shelter and walk across trail. Take right fork and then Culpepper Mine Rd. At next intersection, bear left and stay on wide (bridal) trail. Plot is 40m from trail. Or park in church parking lot, north of park.",FALSE,NA,120,9,FALSE,22,NA,NA,"Camilla  Seirup",2012-06-13 16:20:05,"Camilla  Seirup",2015-09-15 08:53:09,NA
"A84BBAB2-6A5E-4A4C-A64D-04D9241F18D1",300349,4143063,37.41286363,-77.25597597,"meters","UTM","18N","NAD83",2.20000004768372,"RICH","VS","mixed hardwood with viney understory","230",24,"3","Park at main parking area; Follow trail to Melvern Hill Cliffs; Go down hill (moving SW); Plot is on edge of agricultural field.",FALSE,NA,0,2,FALSE,21,NA,NA,"mary  short",2012-06-13 16:20:05,"mary  short",2013-09-05 09:15:35,NA
"A878B931-2CC4-41F5-B221-2D6ADC9EE9B2",364854,4121057,37.22623611,-76.52337964,"meters","UTM","18N","NAD83",4,"COLO_YORK","VS","Sycamore, sweet gum, and tulip poplar canopy with paw paw understory. Stream runs through plot. Much evidence of flooding in 2013.  A bunch of trash has also been deposited with the flooding.","358",52,"3","Park on Goosly Rd and walk 60m to plot.",FALSE,NA,0,360,FALSE,26,NA,NA,"Camilla  Seirup",2013-08-08 15:17:36,"Camilla  Seirup",2013-08-08 17:01:40,NA
"A8F39321-3D8E-4243-AF18-A0FFDBF70561",627041,4527085,40.88499581,-73.49207626,"meters","UTM","18N","NAD83",1.39999997615814,"SAHI","VS","Oddly open, lots of tox rad as ground cover. Mixed hardwood canopy.","237",3,"3","Take trail behind museum; Bear right at fork; Follow for about 270 meters; Cut in to the right about 50 meters; Plot located in valley between two small ridges",FALSE,NA,50,170,FALSE,22,NA,NA,"Mark  Johnson",2012-06-13 16:20:05,"Mark  Johnson",2017-09-13 14:41:51,NA
"AA80438F-B467-4897-8A8A-4970BCB70B4D",263091,4243286,38.30640633,-77.70943927,"meters","UTM","18N","NAD83",0,"FRSP_CHWILD","VS","Shrubby plot, lots of Kalmia latifolia and Gaylussacia. Short canopy, mostly Quercus montana.","062",13,"1","Park on Brock Rd in pull out by large cannon. Walk along rd, plot is 30m from rd.",FALSE,NA,0,11,FALSE,21,NA,NA,"Camilla  Seirup",2012-06-13 16:20:05,"Camilla  Seirup",2015-09-16 08:47:58,NA
"AB3B62B6-30B1-4031-B690-C5A2E2B4F643",273354,4234546,38.23036966,-77.58938148,"meters","UTM","18N","NAD83",2.40000009536743,"FRSP_SPOT","VS","Tulip tree forest with beech and holly midstory, sparse understory","290",26,"4","Drive on access road to end, near chimney's ruins, walk ~ 430m NE to plot",FALSE,NA,0,360,FALSE,21,NA,NA,"{1E30DBBB-8860-48D4-95EC-A8F90A7ED26B}",2010-09-27 13:12:06,"Casey  Croshaw",2018-08-20 11:34:24,NA
"AB9DF80B-1C5D-4134-9190-0BE4EB7340FC",290602,4122051,37.2214717,-77.36010195,"meters","UTM","18N","NAD83",NA,"PETE_EAST","VS","Orientation changed from 360 to 3. Microstegium understory, pine overstory, liquidambar and sassafrass midstory. Fairly open, am plot","024",6,"1","Park at horse trailer parking lot near headquarters and walk 100m back along the road, then left into the woods about 40m.",FALSE,NA,64,3,FALSE,22,NA,NA,"Thomas  Faust",2011-09-06 07:33:41,"Sam A Bietsch",2019-08-13 07:50:57,NA
"ADF512E1-34AE-4CB6-B139-2A3656F9FA33",462357,4440328,40.11241685,-75.44171711,"meters","UTM","18N","NAD83",3.79999995231628,"VAFO","VS","Plot moved 20M N due to paved bike trail. Orientation changed from 55 to 50 7/24/14. BR is under log, reset bottom micro. Steep slope on part plot, slippery","246",30,"4","Drive to Betzwood Parking lot, continue along parking lot until you see bikre trail ramp on right.  Enter bike trail carefully using a spotter and make a left.  Drive slowly along bike trail, past plot and park off the bike path near clearing.about 300 meters past plot.",FALSE,NA,235,50,FALSE,23,NA,NA,"{501A76CE-EBF1-4C9C-84CE-9054EF60994B}",2010-09-26 20:02:12,"Mark  Johnso",2018-07-25 10:41:08,NA
"AEA6DF69-86A6-4846-B888-4E4909370899",NA,NA,NA,NA,"meters","UTM",NA,"NAD83",NA,"VAFO","TEST","PRACTICE PLOT for MIDN training. Center stake reads 342.","9999",NA,"9","Behind VAFO RM garage.",FALSE,NA,10,190,FALSE,NA,NA,NA,"Camilla  Seirup",2018-07-23 08:14:42,"Camilla  Seirup",2018-07-23 08:19:14,NA
"AEF558FF-93B7-4D54-9079-5B5BBB99EE05",290107,4145555,37.43304229,-77.37232631,"meters","UTM","18N","NAD83",1.70000004768372,"RICH","VS","Mixed hardwood with sparse gaylussacia/vaccinium understory","311",32,"4","Appx. 180 meters at 90 degrees from road.",FALSE,NA,0,357,FALSE,21,NA,NA,"{501A76CE-EBF1-4C9C-84CE-9054EF60994B}",2010-09-22 14:51:49,"mary  short",2014-09-03 13:03:49,NA
"AF02DD11-079E-473D-8371-9C89F0AEC180",483582,4220526,NA,NA,"meters","UTM","18 N","NAD83",5,"ASIS","VS","Very open Pinus taeda dominated stand with Smilax understory. BRING KNEE BOOTS, plenty of water for this site.","390",2071,"1","Take dune crossing at KM 23.5 and park at end of road. Walk West around 'the gut' (wetland and small stream complex). You must go around the standing water, and the route is more circuitous than it may appear. Proceed into Pinus taeda forest 50m. May be able to access plot via kayak.",FALSE,NA,0,360,FALSE,19,NA,NA,"Devon R Brock-Montgomery",2019-09-12 12:58:51,"Camilla  Seirup",2019-09-19 10:22:14,NA
"AF8AD968-0971-4FB1-8E8D-E8B6238B5B78",259101,4242546,38.29868233,-77.75477091,"meters","UTM","18N","NAD83",0,"FRSP_CHWILD","VS","Oak/hickory canopy, ilex subcanopy, sparse ground cover.","074",5,"1","park next to gated entrace to hay field. 950m walk to plot, 400m from forest edge to plot.",FALSE,NA,45,7,FALSE,22,NA,NA,"Thomas  Faust",2011-09-07 16:38:21,"Camilla  Seirup",2015-09-14 13:35:49,NA
